<?xml version="1.0" encoding="UTF-8"?>
<lncvmodule id="6312" xmlns:xsi="http://www.w3.org/2001/XMLSchema-instance" xsi:noNamespaceSchemaLocation="lncvmodule.xsd">
  <license url="https://creativecommons.org/licenses/by/4.0/">CC-BY-4.0</license>
  <source url="https://github.com/traintastic/lncv">LNCV @ GitHub</source>
  <author>Reinder Feenstra</author>
  <vendor>Uhlenbrock</vendor>
  <name language="en-us">USB LocoNet interface 63120</name>
  <lncv lncv="0">
    <name language="en-us">Module address</name>
    <value default="1"/>
  </lncv>
  <lncv lncv="1">
    <name language="en-us">Software version</name>
    <value readonly="true"/>
  </lncv>
  <lncv lncv="2">
    <name language="en-us">Baudrate</name>
    <value default="4">
      <option value="1">
        <name>19200</name>
      </option>
      <option value="2">
        <name>38400</name>
      </option>
      <option value="3">
        <name>57600</name>
      </option>
      <option value="4">
        <name>115200</name>
      </option>
    </value>
  </lncv>
  <lncv lncv="4">
    <name language="en-us">LocoNet direct mode</name>
    <value default="0">
      <option value="0">
        <name language="en-us">Off</name>
      </option>
      <option value="1">
        <name language="en-us">On</name>
      </option>
    </value>
  </lncv>
</lncvmodule>
